,root_symbol,exchange,name_x,months,ticker,Exchange,name_y,multiplier,tick_size
268,XAU,CME,E-mini Utilities Sector Futures,HM,CME/XAU,,,,
269,Y7,NYMEX,Tennessee 500 Leg Natural Gas (Platts Gas Daily/Platts IFERC) Index Futures,HJKMNQUV,CME/Y7,,,,
270,9F,NYMEX,Texas Gas Zone 1 Natural Gas (Platts IFERC) Basis Futures,FGHJKMNQUVXZ,CME/9F,,,,
271,Z1,NYMEX,Ethanol T2 FOB Rdam Including Duty (Platts) Futures,HJKMNQUVXZ,CME/Z1,,,,
272,GE,NYMEX,Gulf Coast Jet Fuel (Platts) Futures,FGHJKMNQUVXZ,CME/GE,,,,
273,S4,NYMEX,PJM APS Zone Peak Calendar-Month Day-Ahead LMP Futures,FGHJKMNQUVXZ,CME/S4,,,,
274,DY,CME,Dry Whey Futures,FGHJKMNQUVXZ,CME/DY,CME,Dry Whey,440.0,0.25
275,SSI,NYMEX,Coal (API 8) cfr South China (Argus/McCloskey) Futures,FGHJKMNQUVXZ,CME/SSI,SGX,Nikkei 225 Index,500.0,0.01
276,YW,CBT,Mini Wheat Futures,HKNUZ,CME/YW,,,,
277,1R,NYMEX,Propane Non-LDH Mont Belvieu (OPIS) Futures,FGHJKMNQUVXZ,CME/1R,,,,
278,MJN,NYMEX,Mini Japan C&F Naphtha (Platts) Futures,FGHJKMNQUVXZ,CME/MJN,,,,
279,MBE,NYMEX,Mont Belvieu Spot Ethylene In-Well Futures,FGHJKMNQUVXZ,CME/MBE,,,,
280,XAP,CME,E-mini Consumer Staples Sector Futures,HM,CME/XAP,,,,
281,MNB,NYMEX,Mont Belvieu Normal Butane LDH (OPIS) Futures,FGHJKMNQUVXZ,CME/MNB,,,,
282,5C,NYMEX,Chicago ULSD (Platts) vs. NY Harbor ULSD Futures,FGHJKMNQUVXZ,CME/5C,,,,
283,XAK,CME,E-mini Technology Sector Futures,HM,CME/XAK,,,,
284,SD,NYMEX,Singapore Fuel Oil 180 cst (Platts) vs. 380 cst (Platts) Futures,FGHJKMNQUVXZ,CME/SD,,,,
285,7Y,NYMEX,NY ULSD (Argus) vs. NY Harbor ULSD Futures,FGHJKMNQUVXZ,CME/7Y,,,,
286,PF,NYMEX,Ventura Natural Gas (Platts IFERC) Basis Futures,FGHJKMNQUVXZ,CME/PF,,,,
287,8Z,NYMEX,Southern Star Tx.-Okla.-Kan. Natural Gas (Platts IFERC) Basis Futures,FGHJKMNQUVXZ,CME/8Z,,,,
288,MBN,NYMEX,Mont Belvieu Ethylene (PCW) Financial Futures,FGHJKMNQUVXZ,CME/MBN,,,,
289,BY,CME,British Pound/Japanese Yen Futures,HMUZ,CME/BY,ICECA,Barley-Continental,100.0,0.01
290,1U,NYMEX,NY Jet Fuel (Platts) vs. NY Harbor ULSD Futures,HJKMNQU,CME/1U,,,,
291,PZ,CME,Polish Zloty Futures,HMUZ,CME/PZ,ICEUS,British Pound/South African Rand,125000.0,0.25
292,6Z,NYMEX,Tennessee 800 Leg Natural Gas (Platts IFERC) Basis Futures,JKUVX,CME/6Z,,,,
293,MGC,CEC,E-micro Gold Futures,GJMQVZ,CME/MGC,COMEX,E-Micro Gold,10.0,0.01
294,BOB,NYMEX,3.5% Fuel Oil Barges FOB Rdam (Platts) Crack Spread (1000mt) Futures,FGHJKMNQUVXZ,CME/BOB,,,,
295,TRY,CME,Turkish Lira Futures,HMUZ,CME/TRY,CME,Turkish Lira,200000.0,0.01
296,UN,NYMEX,European Naphtha Cargoes CIF NWE (Platts) Futures,FGHJKMNQUVXZ,CME/UN,,,,
297,PDM,NYMEX,MISO Indiana Hub Day-Ahead Peak Calendar-Month 5 MW Futures,FGHJKMNQUVXZ,CME/PDM,,,,
298,71,CBT,Ethanol Forward Month Futures,FGHJKMNQUVXZ,CME/71,,,,
299,4N,NYMEX,PJM PECO Zone 5 MW Peak Calendar-Month Day-Ahead LMP Futures,FGHJKMNQUVXZ,CME/4N,,,,
300,GCI,NYMEX,Gulf Coast No.6 Fuel Oil 3.0% (Platts) Brent Crack Spread Futures,FGHJKMNQUVXZ,CME/GCI,ICEEUROPE,ICE Gas Oil Crack,,
301,XAF,CME,E-mini Financial Sector Futures,HM,CME/XAF,,,,
302,CNH,CME,Standard-Size USD/Offshore RMB (CNH) Futures,FGHJKMNQUVXZ,CME/CNH,CME,USD/Offshore RMB(CNH),100000.0,0.01
303,ARW,NYMEX,Gulf Coast Unl 87 Gasoline M1 (Platts) Crack Spread Futures,HJKMNQU,CME/ARW,,,,
304,KK,NYMEX,NYISO Zone J Off-Peak LBMP Futures,FGHJKMNQUVXZ,CME/KK,CLEAR,NYISO A Electricity,400.0,0.01
305,JS,NYMEX,Los Angeles Jet (OPIS) vs. NY Harbor ULSD Futures,HJKM,CME/JS,,,,
306,XAY,CME,E-mini Consumer Discretionary Sector Futures,HM,CME/XAY,,,,
307,MCC,NYMEX,Indonesian Coal (McCloskey sub-bituminous) Futures,FGHJKMNQUVXZ,CME/MCC,,,,
308,FP,NYMEX,Florida Gas Zone 3 Natural Gas (Platts IFERC) Basis Futures,FGHJKMNQUVXZ,CME/FP,,,,
309,WQ,NYMEX,Gasoil 0.1 Barges FOB Rdam (Platts) vs. Gasoil Futures,HJKMNQUVXZ,CME/WQ,,,,
310,PC,NYMEX,PG&E Citygate Natural Gas (Platts IFERC) Basis Futures,JKMNQUVXZ,CME/PC,ICEUS,British Pound/Canadian Dollar,125000.0,0.05
311,J7,CME,E-mini Japanese Yen Futures,MU,CME/J7,,,,
312,M6B,CME,E-micro British Pound/American Dollar Futures,MU,CME/M6B,CME,e-micro GBP / USD,6250.0,0.01
313,8I,NYMEX,Mont Belvieu Iso-Butane (OPIS) Futures,FGHJKMNQUVXZ,CME/8I,,,,
